{
  "schemaVersion": "1.1.0",
  "id": "obs:nightly:2026-09-15:enterprise-agent-capital",
  "type": "Observation",
  "capturedAt": "2026-09-15T23:24:08Z",
  "claim": "Factory's new $200 million financing at a reported $5 billion valuation is a strong capital signal for governed, model-agnostic enterprise software agents rather than isolated coding assistants.",
  "verifiedFacts": [
    "Reuters reported Factory raised $200 million and reached a $5 billion valuation on September 15, 2026.",
    "Factory builds agents for enterprise engineering teams and emphasizes model-agnostic operation.",
    "Factory's existing materials describe enterprise customers using agents across software lifecycle work."
  ],
  "inference": [
    "Enterprise agent value is shifting toward lifecycle integration, governance, deployment flexibility, and measurable effectiveness rather than code generation alone.",
    "Consultancy implication: Seed Loom should not compete with coding-agent platforms; it should prove the independent evidence, authority, evaluation, and receipt layer around agent-authored change."
  ],
  "significance": "Strengthens the commercial rationale for the approved Agent Evaluation & Delivery Control Review while clarifying a non-competing product boundary.",
  "confidence": 0.97,
  "evidenceMaturity": "source-backed",
  "evidenceClass": "funding",
  "sourceRefs": [
    "source:reuters:factory-funding:2026-09-15"
  ],
  "actorRefs": [
    "actor:factory:builder",
    "actor:venture-investors:funders",
    "actor:enterprise-engineering:buyers"
  ],
  "affectedRepositories": [
    "qt314wink/seed-loom"
  ],
  "assumptions": [
    "Capital and customer claims indicate durable enterprise demand, not only valuation momentum."
  ],
  "knownLimitations": [
    "Funding valuation does not prove customer ROI or agent reliability."
  ],
  "counterevidenceRefs": [],
  "approvalState": "candidate"
}
